{
  "schema": "fdir/qualification-issue-104-corpus",
  "version": "1.0.0",
  "issueNumber": 104,
  "qualificationScope": "independent-multi-producer-hostile-corpus",
  "reportNames": [
    "corpus-provenance-independence.json",
    "requirement-corpus-coverage.json",
    "multi-producer-results.json",
    "differential-adjudication.json",
    "metamorphic-relations.json",
    "hostile-resource-boundaries.json",
    "fixture-oracle-digest-manifest.json"
  ],
  "oracle": {
    "expectedValuesAreRuntimeIndependent": true,
    "expectedFactsAreAuthored": true,
    "adapterOutputUsedForExpected": false,
    "adapterOutputUsedToCreateCorpus": false,
    "sourceReader": "qualification-runner-owned-byte-reader",
    "forbiddenDerivations": [
      "adapter output",
      "adapter output collections or keys",
      "runtime conversion output used as an expected value",
      "manifest independent boolean",
      "generic token presence as a substitute for a source fact"
    ]
  },
  "gradePolicy": {
    "scale": {
      "A": "independently acquired official or real-producer artifact with immutable provenance and authored adjudication",
      "B": "independently acquired artifact with complete digest and one authored adjudication record",
      "C": "checked-in hand-authored source with immutable digest and source-side authored facts",
      "D": "self-declared, generated, adapter-derived, or otherwise unverifiable evidence",
      "unavailable": "required evidence is declared but no artifact is available at qualification time"
    },
    "minimumPassingGrade": "C",
    "requiredPassingGrades": ["A", "B", "C"],
    "gradeDIsNonQualifying": true,
    "requireAtLeastOneAvailableNonD": true,
    "requiredOfficialArtifactsCannotBeReplacedByGradeD": true
  },
  "fixtures": [
    {
      "fixtureId": "docx-independent-relationship",
      "scenarioId": "docx-relationship-and-text",
      "format": "docx",
      "producerId": "synthetic-docx-author",
      "independenceGrade": "C",
      "source": {
        "type": "repository-directory",
        "path": "e2e/corpus/docx-independent"
      },
      "provenance": {
        "origin": "checked-in hand-authored OOXML parts",
        "sourceReference": "e2e/corpus/docx-independent",
        "acquisitionMethod": "repository-checkout",
        "available": true,
        "producerClaim": "synthetic standards-focused author"
      },
      "sourceDigest": {
        "algorithm": "sha256",
        "mode": "member-manifest",
        "members": [
          {"path": "[Content_Types].xml", "bytes": 424, "sha256": "3cace3ea56c94fe33d676819592ded5bb8e1959e505bf38e08ddc080766730ab"},
          {"path": "_rels/.rels", "bytes": 286, "sha256": "23e29b42d618f14cf038618de94a6725714917d10ec2583f7a6b25b7879381ef"},
          {"path": "word/_rels/document.xml.rels", "bytes": 287, "sha256": "87ba91bb700c2bf6210bde9d557b0febbdd571e49bd3cfe79d0b74ab9b3f31f7"},
          {"path": "word/document.xml", "bytes": 264, "sha256": "a51a101d70a19ba664e338f4532347126b6eeead90da117f8e6fcc875896ba96"}
        ]
      },
      "expectedFacts": [
        {"factId": "docx-text-independent", "kind": "literal", "value": "Independent DOCX", "sourceContains": true, "outputContains": true},
        {"factId": "docx-text-relationship", "kind": "literal", "value": "relationship", "sourceContains": true, "outputContains": true},
        {"factId": "docx-missing-target-authored", "kind": "literal", "value": "media/not-present.png", "sourceMember": "word/_rels/document.xml.rels", "sourceContains": true, "outputContains": true}
      ],
      "oracleDigest": "987a6011734688b8d3b3b02cabf2effeee84d13da1e125d437af169d790d535c"
    },
    {
      "fixtureId": "docx-independent-story",
      "scenarioId": "docx-story-header",
      "format": "docx",
      "producerId": "synthetic-docx-story-author",
      "independenceGrade": "C",
      "source": {
        "type": "repository-directory",
        "path": "e2e/corpus/docx-story-independent"
      },
      "provenance": {
        "origin": "checked-in hand-authored OOXML story parts",
        "sourceReference": "e2e/corpus/docx-story-independent",
        "acquisitionMethod": "repository-checkout",
        "available": true,
        "producerClaim": "synthetic story author"
      },
      "sourceDigest": {
        "algorithm": "sha256",
        "mode": "member-manifest",
        "members": [
          {"path": "[Content_Types].xml", "bytes": 555, "sha256": "1e29e2665aafd0077b122bd3028f68c22c1a0cdef9752323db7c007533f37a27"},
          {"path": "_rels/.rels", "bytes": 286, "sha256": "23e29b42d618f14cf038618de94a6725714917d10ec2583f7a6b25b7879381ef"},
          {"path": "word/_rels/document.xml.rels", "bytes": 277, "sha256": "59c131f6644c48569b330867ffd2b3233fd0371644379c535d40f6bbaef9f61f"},
          {"path": "word/document.xml", "bytes": 378, "sha256": "076d9ff5bb20f752a9a7328c0e350f1206c2bd3694e5bb466ca356169405c77d"},
          {"path": "word/header1.xml", "bytes": 175, "sha256": "99f1a0dad6142b338b6e56379049d4e906dad0274956ca31626d8a2b34958be2"}
        ]
      },
      "expectedFacts": [
        {"factId": "docx-story-header", "kind": "literal", "value": "Story Header", "sourceMember": "word/header1.xml", "sourceContains": true, "outputContains": true},
        {"factId": "docx-story-body", "kind": "literal", "value": "Independent DOCX story", "sourceMember": "word/document.xml", "sourceContains": true, "outputContains": true}
      ],
      "oracleDigest": "56f544a4d904fbf53b43173eed1499b1cff5b611a72eb9ba7f6116b9e09bee77"
    },
    {
      "fixtureId": "xlsx-independent-values",
      "scenarioId": "xlsx-values-and-formula",
      "format": "xlsx",
      "producerId": "synthetic-xlsx-author",
      "independenceGrade": "C",
      "source": {
        "type": "repository-directory",
        "path": "e2e/corpus/xlsx-independent"
      },
      "provenance": {
        "origin": "checked-in hand-authored OOXML workbook parts",
        "sourceReference": "e2e/corpus/xlsx-independent",
        "acquisitionMethod": "repository-checkout",
        "available": true,
        "producerClaim": "synthetic spreadsheet author"
      },
      "sourceDigest": {
        "algorithm": "sha256",
        "mode": "member-manifest",
        "members": [
          {"path": "[Content_Types].xml", "bytes": 555, "sha256": "383f7e7b4f05bac13d7f9d2a05bb726d21f1b6af23ba83a98aadeabf865ce35e"},
          {"path": "_rels/.rels", "bytes": 284, "sha256": "a9306161b7b09da358b74971c93a880d581f1f71f1dfaf4984200e6fe6f94ffb"},
          {"path": "xl/_rels/workbook.xml.rels", "bytes": 289, "sha256": "e13de3cabe36e884fde730456801c851f41b1747f43c777fd9826d5178fe79c3"},
          {"path": "xl/workbook.xml", "bytes": 281, "sha256": "baa185217aa3930a09f766edaea120518bf8fd2b3516d3d80c256464dbd24f5c"},
          {"path": "xl/worksheets/sheet1.xml", "bytes": 380, "sha256": "a26c80cd1bee7a7b76daa7f0de410ec5e59a33fe60abdeb0f6d935ecc1dd5ffc"}
        ]
      },
      "expectedFacts": [
        {"factId": "xlsx-workbook-name", "kind": "literal", "value": "Independent", "sourceMember": "xl/workbook.xml", "sourceContains": true, "outputContains": true},
        {"factId": "xlsx-formula-authored", "kind": "literal", "value": "SUM(A1:A2)", "sourceMember": "xl/worksheets/sheet1.xml", "sourceContains": true, "outputContains": true},
        {"factId": "xlsx-stored-value-three", "kind": "literal", "value": "3", "sourceMember": "xl/worksheets/sheet1.xml", "sourceContains": true, "outputContains": true}
      ],
      "oracleDigest": "e5e45c4f6b90e9f281de96cf2143819591389372b70566c874919dd481d3517f"
    },
    {
      "fixtureId": "pdf-independent-text",
      "scenarioId": "pdf-basic-text",
      "format": "pdf",
      "producerId": "synthetic-pdf-author",
      "independenceGrade": "C",
      "source": {
        "type": "repository-file",
        "path": "e2e/corpus/pdf-independent.pdf"
      },
      "provenance": {
        "origin": "checked-in hand-authored PDF bytes",
        "sourceReference": "e2e/corpus/pdf-independent.pdf",
        "acquisitionMethod": "repository-checkout",
        "available": true,
        "producerClaim": "synthetic PDF author"
      },
      "sourceDigest": {"algorithm": "sha256", "mode": "file", "bytes": 498, "sha256": "189e0242812b4ee9b91ebf963c67f225b6b0470104737065f6312596ba928ab5"},
      "expectedFacts": [
        {"factId": "pdf-text-independent", "kind": "literal", "value": "Independent PDF", "sourceContains": true, "outputContains": true}
      ],
      "oracleDigest": "3686e88ed6f5cb3b0c75c09afeb74ab24fee6f1135690534fccdde5e11838eab"
    },
    {
      "fixtureId": "pdf-independent-cmap",
      "scenarioId": "pdf-glyph-cmap",
      "format": "pdf",
      "producerId": "synthetic-pdf-cmap-author",
      "independenceGrade": "C",
      "source": {
        "type": "repository-file",
        "path": "e2e/corpus/pdf-cmap.pdf"
      },
      "provenance": {
        "origin": "checked-in hand-authored PDF font mapping bytes",
        "sourceReference": "e2e/corpus/pdf-cmap.pdf",
        "acquisitionMethod": "repository-checkout",
        "available": true,
        "producerClaim": "synthetic PDF glyph author"
      },
      "sourceDigest": {"algorithm": "sha256", "mode": "file", "bytes": 833, "sha256": "f05a244952ea010e187bca03eeca5ac5cd6c1e2b4d02de6ed20ddd9d7ea5eef1"},
      "expectedFacts": [
        {"factId": "pdf-cmap-character", "kind": "literal", "value": "A", "sourceContains": true, "outputContains": true}
      ],
      "oracleDigest": "5e1735295e3c18089e88979c15a1cc1b8481d275323dde454e0f41831429e1a8"
    },
    {
      "fixtureId": "markdown-independent-authoring",
      "scenarioId": "markdown-nested-table-and-link",
      "format": "markdown",
      "producerId": "synthetic-markdown-author",
      "independenceGrade": "C",
      "source": {
        "type": "repository-file",
        "path": "e2e/corpus/markdown-independent.md"
      },
      "provenance": {